{
  "title": "采购审批流程",
  "level": "L5",
  "process_id": "purchase-approval",
  "boundary": {
    "start": "提交采购申请",
    "end": "采购完成"
  },
  "lanes": [
    {
      "lane_id": "Lane-001",
      "name": "申请人",
      "org_candidates": []
    },
    {
      "lane_id": "Lane-002",
      "name": "部门经理",
      "org_candidates": []
    }
  ],
  "elements": [
    {
      "element_id": "Activity-001",
      "kind": "ACTIVITY",
      "name": "提交采购申请",
      "lane_id": "Lane-001",
      "inputs": [],
      "outputs": ["采购申请单"],
      "evidence_refs": ["B-001"],
      "certainty": "EXPLICIT",
      "question_ids": []
    },
    {
      "element_id": "Activity-002",
      "kind": "ACTIVITY",
      "name": "审核采购申请",
      "lane_id": "Lane-002",
      "inputs": ["采购申请单"],
      "outputs": ["审批结果"],
      "evidence_refs": ["B-001"],
      "certainty": "EXPLICIT",
      "question_ids": []
    }
  ],
  "flows": [
    {
      "flow_id": "Flow-001",
      "source_ref": "Activity-001",
      "target_ref": "Activity-002",
      "condition": null,
      "evidence_refs": ["B-001"]
    }
  ],
  "questions": [],
  "conflicts": [],
  "source_summary": {
    "total_blocks": 1,
    "formats": ["pdf"],
    "evidence_refs": ["B-001"]
  }
}
